Code,Name,Description
319,"Despatch, preparation error",An error occurred during the preparation of the despatch.
320,"Undefined incident attributed to logistic server provider",An undefined incident has occurred which has been attributed to the logistic service provider.
321,"Instruction to despatch, received",The instruction to despatch has been received.
322,"Despatch, under preparation",The despatch of the goods/consignment/equipment is in preparation.
323,"Return in progress",The goods/consignment/equipment is being returned.
324,"Instruction to despatch, cancelled",The instruction to despatch has been cancelled.
325,"Delivery refused, by recipient",The delivery of the goods/consignment/equipment has been refused by the recipient.
326,"Goods, held by third party on instruction from owner",Goods are held under control of a third party following an instruction from the owner of the goods.
327,"Weight or volume loss",The goods have suffered a weight or volume loss.
328,"Moved, internally",The goods/consignment/equipment has been moved internally.
329,"Consignment partially stolen",The consignment has been partially stolen.
330,"Consignment partially lost or missing",The consignment is partially lost or missing.
331,"Destroyed ",The goods/consignment/equipment has been destroyed.
332,"Action by logistics service provider",An action was taken by the logistics service provider. 
333,"Action by logistics service provider on instruction by owner",An action was taken by the logistics service provider as instructed by owner of the goods. 
334,"Document, refused",The document has been refused.
335,"Seals, damaged",The seals on the equipment have been damaged.
336,"Seals, broken",The seals on the equipment have been broken.
337,"Seals, tampered",The seals on the equipment have been tampered.
338,"Collection/pick-up, business closed",The goods/consignment/equipment could not be collected/picked-up as the business was closed.
339,"Collection/pick-up, changed schedule",The goods/consignment/equipment cannot be collected/picked-up at the arranged time because of a change of schedule.
340,"Collection/pick-up, further address needed",A further address is needed to effect collection/pick-up of the goods/consignment/ equipment.
341,"Collection/pick-up, industrial dispute",The goods/consignment/equipment cannot be collected/picked-up due to an industrial dispute.
342,"Collection/pick-up, equipment failure",The goods/consignment/equipment cannot be collected/picked-up due to a failure in the equipment.
343,"Document, incorrect",The document for the goods/consignments/equipment is incorrect.
344,"Collection/pick-up, scheduled past cut-off time",The goods/consignment/equipment to be collected/picked-up has been scheduled past the cut-off time.
345,"Collection/pick-up, adverse weather conditions",Adverse weather conditions have affected collection/pick-up.
346,"Unloading, completed from a means of transport",The goods/consignment/equipment has been unloaded from a means of transport.
347,"Deliverable",The goods/consignment/equipment can be delivered.
348,"Not deliverable",The goods/consignment/equipment cannot be delivered.
349,"Handed over",The goods/consignment/equipment has been handed over to another party.
350,"Signature required",A signature is required.
351,"Defined incident attributed to logistic server provider",A defined incident has occurred which has been attributed to the logistic service provider.
352,"Delivery not completed, business closed, inventory count",The goods/consignment/equipment could not be delivered as the business was closed due to inventory count.
353,"Delivery not completed, business closed on Saturday",The goods/consignment/equipment could not be delivered as the business was closed on Saturday.
354,"Delivery not completed, business closed on national holiday",The goods/consignment/equipment could not be delivered as the business was closed on a national holiday.
355,"En route, via local route",The goods/consignment/equipment/means of transport is moving to destination via a local route.
356,"En route, via national route",The goods/consignment/equipment/means of transport is moving to destination via a national route.
357,"En route, via international route",The goods/consignment/equipment/means of transport is moving to destination via an international route.
358,"Transport terminated, mail not received",The transport of the goods/consignment/equipment/means of transport has been terminated and the mail has not been received.
359,"Bill of Lading issued",The Bill of Lading for the goods/consignment/equipment has been issued.
360,"Cleared, by logistics service provider",The goods/consignment/equipment/means of transport has been cleared by logistics service provider.
361,"Delivery, expected",The goods/consignment/equipment expected to be delivered.
362,"Measured",The goods/consignment/equipment/means of transport has been measured.
363,"Loading, ready",The goods/consignment/equipment is ready to be loaded onto a means of transport.
364,"Arrival, at yard",The goods/consignment/equipment/means of transport has arrived at the yard.
365,"Departure, from yard",The goods/consignment/equipment/means of transport has departed from the yard.
366,"Accepted at interchange point",The goods/consignment/equipment/means of transport has been accepted at the interchange point.
367,"Alerted, no action taken",No action taken after an alert in relation to the goods/consignment/equipment/means of transport.
368,"Transshipment to another wagon",The goods/consignment has been transhipped to another wagon.
369,"Trip plan revised manually",The transport route has been re-programmed manually.
370,"Special wagon handling arranged",The handling of a special wagon has been arranged.
371,"Equipment, emptied",The equipment has been emptied.
372,"Equipment, loaded",The equipment has been loaded.
373,"Equipment, held by transport operator",The equipment has been held by the transport operator.
374,"Equipment, held by terminal operator",The equipment has been held by the terminal operator.
375,"Equipment, storage period at terminal",exceeded	The equipment storage period at a transport terminal has been exceeded. 
376,"Equipment, held by equipment operator",The equipment has been held by the equipment operator.
377,"Equipment, not released by equipment operator",The equipment has not been released by the equipment operator.
378,"Delivery Order Issued",Delivery Order for the goods/consignment/equipment/means has been issued.
379,"Cleared for container release",The procedures of containers’ release from container yard have been cleared by all authorities and private sectors.
